{"message_id": "14019603-a4f6-4145-93a7-c7f51e55f6cf", "event_id": "3c823475-42f6-4de6-b3ef-31a65f08b07c", "trace_id": "d1fa5334-54a6-4b58-8b35-09c13c01e087", "schema_version": "v1", "occurred_at": "2026-08-25T13:50:22.437220Z", "source": "cloud:llm-service", "payload": {"event_id": "3c823475-42f6-4de6-b3ef-31a65f08b07c", "trace_id": "d1fa5334-54a6-4b58-8b35-09c13c01e087", "judgment": "confirm", "confidence": 0.85, "advice": "检测到疑似癫痫发作特征，请立即前往病房评估并呼叫医生。", "latency_ms": 0.1, "model_name": "qwen2.5-14b", "model_version": "Qwen2.5-14B-Instruct-AWQ", "status": "completed"}}
